{
  "sir_version": "0.1.0",
  "world": {
    "id": "world_demo_block",
    "name": "SIR Reference Block",
    "linear_unit": "m",
    "up_axis": "Z",
    "coordinate_frame": "local_ENU",
    "crs": null,
    "origin": [
      0.0,
      0.0,
      0.0
    ],
    "metadata": {
      "purpose": "synthetic_roundtrip_reference"
    }
  },
  "entities": [
    {
      "id": "bldg_01",
      "name": "Reference Building",
      "kind": "space",
      "class": "Building",
      "semantic_resolution": "object",
      "epistemic_state": "generated",
      "confidence": {
        "overall": 1.0,
        "geometry": 1.0,
        "semantics": 1.0,
        "topology": 1.0
      },
      "geometry": [
        {
          "id": "g_bldg_extent",
          "representation": "primitive",
          "role": "extent",
          "geometric_tolerance_m": 0.001,
          "primitive": {
            "type": "box",
            "center": [
              0,
              0,
              3
            ],
            "size": [
              12,
              8,
              6
            ],
            "orientation_wxyz": [
              1,
              0,
              0,
              0
            ]
          },
          "provenance": [
            {
              "mode": "procedural_generation",
              "algorithm": "sir_reference_scene",
              "version": "0.1.0",
              "parameters_hash": "reference-fixed"
            }
          ],
          "metadata": {}
        }
      ],
      "provenance": [
        {
          "mode": "procedural_generation",
          "algorithm": "sir_reference_scene",
          "version": "0.1.0",
          "parameters_hash": "reference-fixed"
        }
      ],
      "attributes": {
        "render": false,
        "floors": 2
      },
      "labels": {
        "benchmark": "reference"
      }
    },
    {
      "id": "wall_n",
      "name": "North Wall",
      "kind": "boundary",
      "class": "WallSurface",
      "semantic_resolution": "part",
      "epistemic_state": "generated",
      "confidence": {
        "overall": 1.0,
        "geometry": 1.0,
        "semantics": 1.0,
        "topology": 1.0
      },
      "geometry": [
        {
          "id": "g_wall_n",
          "representation": "primitive",
          "role": "render",
          "geometric_tolerance_m": 0.001,
          "primitive": {
            "type": "box",
            "center": [
              0,
              4,
              3
            ],
            "size": [
              12,
              0.2,
              6
            ],
            "orientation_wxyz": [
              1,
              0,
              0,
              0
            ]
          },
          "provenance": [
            {
              "mode": "procedural_generation",
              "algorithm": "sir_reference_scene",
              "version": "0.1.0",
              "parameters_hash": "reference-fixed"
            }
          ],
          "metadata": {}
        }
      ],
      "provenance": [
        {
          "mode": "procedural_generation",
          "algorithm": "sir_reference_scene",
          "version": "0.1.0",
          "parameters_hash": "reference-fixed"
        }
      ],
      "attributes": {
        "orientation": "north"
      },
      "labels": {
        "benchmark": "reference"
      }
    },
    {
      "id": "wall_s",
      "name": "South Wall",
      "kind": "boundary",
      "class": "WallSurface",
      "semantic_resolution": "part",
      "epistemic_state": "generated",
      "confidence": {
        "overall": 1.0,
        "geometry": 1.0,
        "semantics": 1.0,
        "topology": 1.0
      },
      "geometry": [
        {
          "id": "g_wall_s",
          "representation": "primitive",
          "role": "render",
          "geometric_tolerance_m": 0.001,
          "primitive": {
            "type": "box",
            "center": [
              0,
              -4,
              3
            ],
            "size": [
              12,
              0.2,
              6
            ],
            "orientation_wxyz": [
              1,
              0,
              0,
              0
            ]
          },
          "provenance": [
            {
              "mode": "procedural_generation",
              "algorithm": "sir_reference_scene",
              "version": "0.1.0",
              "parameters_hash": "reference-fixed"
            }
          ],
          "metadata": {}
        }
      ],
      "provenance": [
        {
          "mode": "procedural_generation",
          "algorithm": "sir_reference_scene",
          "version": "0.1.0",
          "parameters_hash": "reference-fixed"
        }
      ],
      "attributes": {
        "orientation": "south"
      },
      "labels": {
        "benchmark": "reference"
      }
    },
    {
      "id": "wall_e",
      "name": "East Wall",
      "kind": "boundary",
      "class": "WallSurface",
      "semantic_resolution": "part",
      "epistemic_state": "generated",
      "confidence": {
        "overall": 1.0,
        "geometry": 1.0,
        "semantics": 1.0,
        "topology": 1.0
      },
      "geometry": [
        {
          "id": "g_wall_e",
          "representation": "primitive",
          "role": "render",
          "geometric_tolerance_m": 0.001,
          "primitive": {
            "type": "box",
            "center": [
              6,
              0,
              3
            ],
            "size": [
              0.2,
              8,
              6
            ],
            "orientation_wxyz": [
              1,
              0,
              0,
              0
            ]
          },
          "provenance": [
            {
              "mode": "procedural_generation",
              "algorithm": "sir_reference_scene",
              "version": "0.1.0",
              "parameters_hash": "reference-fixed"
            }
          ],
          "metadata": {}
        }
      ],
      "provenance": [
        {
          "mode": "procedural_generation",
          "algorithm": "sir_reference_scene",
          "version": "0.1.0",
          "parameters_hash": "reference-fixed"
        }
      ],
      "attributes": {
        "orientation": "east"
      },
      "labels": {
        "benchmark": "reference"
      }
    },
    {
      "id": "wall_w",
      "name": "West Wall",
      "kind": "boundary",
      "class": "WallSurface",
      "semantic_resolution": "part",
      "epistemic_state": "generated",
      "confidence": {
        "overall": 1.0,
        "geometry": 1.0,
        "semantics": 1.0,
        "topology": 1.0
      },
      "geometry": [
        {
          "id": "g_wall_w",
          "representation": "primitive",
          "role": "render",
          "geometric_tolerance_m": 0.001,
          "primitive": {
            "type": "box",
            "center": [
              -6,
              0,
              3
            ],
            "size": [
              0.2,
              8,
              6
            ],
            "orientation_wxyz": [
              1,
              0,
              0,
              0
            ]
          },
          "provenance": [
            {
              "mode": "procedural_generation",
              "algorithm": "sir_reference_scene",
              "version": "0.1.0",
              "parameters_hash": "reference-fixed"
            }
          ],
          "metadata": {}
        }
      ],
      "provenance": [
        {
          "mode": "procedural_generation",
          "algorithm": "sir_reference_scene",
          "version": "0.1.0",
          "parameters_hash": "reference-fixed"
        }
      ],
      "attributes": {
        "orientation": "west"
      },
      "labels": {
        "benchmark": "reference"
      }
    },
    {
      "id": "roof_01",
      "name": "Flat Roof",
      "kind": "boundary",
      "class": "RoofSurface",
      "semantic_resolution": "part",
      "epistemic_state": "generated",
      "confidence": {
        "overall": 1.0,
        "geometry": 1.0,
        "semantics": 1.0,
        "topology": 1.0
      },
      "geometry": [
        {
          "id": "g_roof",
          "representation": "primitive",
          "role": "render",
          "geometric_tolerance_m": 0.001,
          "primitive": {
            "type": "box",
            "center": [
              0,
              0,
              6.05
            ],
            "size": [
              12.2,
              8.2,
              0.2
            ],
            "orientation_wxyz": [
              1,
              0,
              0,
              0
            ]
          },
          "provenance": [
            {
              "mode": "procedural_generation",
              "algorithm": "sir_reference_scene",
              "version": "0.1.0",
              "parameters_hash": "reference-fixed"
            }
          ],
          "metadata": {}
        }
      ],
      "provenance": [
        {
          "mode": "procedural_generation",
          "algorithm": "sir_reference_scene",
          "version": "0.1.0",
          "parameters_hash": "reference-fixed"
        }
      ],
      "attributes": {
        "roof_type": "flat"
      },
      "labels": {
        "benchmark": "reference"
      }
    },
    {
      "id": "door_01",
      "name": "South Entry Door",
      "kind": "opening",
      "class": "Door",
      "semantic_resolution": "component",
      "epistemic_state": "generated",
      "confidence": {
        "overall": 1.0,
        "geometry": 1.0,
        "semantics": 1.0,
        "topology": 1.0
      },
      "geometry": [
        {
          "id": "g_door",
          "representation": "primitive",
          "role": "render",
          "geometric_tolerance_m": 0.001,
          "primitive": {
            "type": "box",
            "center": [
              0,
              -4.13,
              1.1
            ],
            "size": [
              1.2,
              0.08,
              2.2
            ],